<xs:schema xmlns:xs="http://www.w3.org/2001/XMLSchema">
    <xs:element name="aeropuerto">
        <xs:complexType>
            <xs:sequence>
                <xs:element name="nombre" type="xs:string"></xs:element>
                <xs:element name="fecha" type="xs:date"></xs:element>
                <xs:element name="vuelos">
                    <xs:complexType>
                        <xs:sequence>
                            <xs:element name="vuelo" minOccurs="0" maxOccurs="unbounded">
                                <xs:complexType>
                                    <xs:sequence>
                                        <xs:element name="origen">
                                            <xs:simpleType>
                                                <xs:restriction base="xs:string">
                                                    <xs:maxLength value="3"></xs:maxLength>
                                                </xs:restriction>
                                            </xs:simpleType>
                                        </xs:element>
                                        <xs:element name="destino" type="xs:string"></xs:element>
                                        <xs:element name="hora-salida" type="xs:time"></xs:element>
                                        <xs:element name="hora-llegada" type="xs:time" minOccurs="0"></xs:element>
                                    </xs:sequence>
                                    <xs:attribute name="codigo" type="xs:ID"></xs:attribute>
                                    <xs:attribute name="estado">
                                        <xs:simpleType>
                                            <xs:restriction base="xs:string">
                                                <xs:maxLength value="1"></xs:maxLength>
                                            </xs:restriction>
                                        </xs:simpleType>
                                    </xs:attribute>
                                </xs:complexType>
                            </xs:element>
                        </xs:sequence>
                    </xs:complexType>
                </xs:element>
            </xs:sequence>
        </xs:complexType>
    </xs:element>
</xs:schema>