<?xml version="1.0" encoding="UTF-8"?>
<aeropuerto xmlns:xsi="http://www.w3.org/2001/XMLSchema-instance" xsi:noNamespaceSchemaLocation="ejemplo_vuelo.xsd">
   <nombre>JFK</nombre>
   <fecha>2023-10-06</fecha>
   <vuelos>
      <vuelo codigo="V22" estado="R">
         <origen>LAX</origen>
         <destino>Chicago</destino>
         <hora-salida>09:30:00</hora-salida>
         <hora-llegada>11:30:00</hora-llegada>
      </vuelo>
      <vuelo codigo="V23" estado="A">
         <origen>JFK</origen>
         <destino>Miami</destino>
         <hora-salida>10:15:00</hora-salida>
      </vuelo>
   </vuelos>
</aeropuerto>